{
  "version": "0.4",
  "layer": "second",
  "status": "partial",
  "source_registry": "workflows/registry.json",
  "source_artifact_registry": "Tasks/artifact-registry.md",
  "api_contract": "workflows/api_contract.md",
  "current_route": {
    "next_workflow_id": "02_literature",
    "next_workflow_name": "文献检索与综述",
    "reason": [
      "query_plan.json: not found at litreview/query_plan.json",
      "literature_candidates.csv: not found at litreview/literature_candidates.csv",
      "references.bib: not found at references.bib",
      "contribution_matrix.md: not found at litreview/contribution_matrix.md"
    ]
  },
  "artifact_status": {
    "present": 3,
    "partial": 0,
    "missing": 0,
    "external": 0
  },
  "spec_coverage": {
    "core_workflows": 10,
    "missing_specs": []
  },
  "workflows": [
    {
      "id": "01_design",
      "step": "01",
      "name": "选题与研究设计",
      "purpose": "把 idea 变成可检验的研究问题、识别口径和风险清单。",
      "agents": [
        "ResearchDesignAgent",
        "DesignAuditor"
      ],
      "inputs": [
        "idea",
        "data_clue",
        "policy_or_treatment_clue"
      ],
      "required_outputs": [
        {
          "artifact": "research_design.md",
          "path_hint": "research_design.md"
        },
        {
          "artifact": "causal_question.yaml",
          "path_hint": "causal_question.yaml"
        },
        {
          "artifact": "design_risk.md",
          "path_hint": "design_risk.md"
        }
      ],
      "gates": [
        {
          "name": "one_sentence_design",
          "type": "human"
        },
        {
          "name": "artifact_presence",
          "type": "automated",
          "command": "python3 scripts/21_route_next_workflow.py"
        }
      ],
      "human_checkpoints": [
        "题目是否值得继续",
        "贡献是否足以成文",
        "识别假设是否可以接受"
      ],
      "stop_conditions": [
        "treatment 不清楚",
        "outcome 不清楚",
        "数据不能回答问题",
        "贡献弱到不值得继续"
      ],
      "rollback_to": null,
      "skills": [
        "aer-topic-selection"
      ],
      "failure_codes": [
        "DESIGN_TREATMENT_UNCLEAR",
        "DESIGN_OUTCOME_UNCLEAR",
        "DESIGN_NO_CONTRIBUTION",
        "DESIGN_DATA_NOT_SUPPORTING",
        "DESIGN_HUMAN_REQUIRED"
      ],
      "current_issues": [],
      "spec_path": "workflows/agents/01_design.agent.md"
    },
    {
      "id": "02_literature",
      "step": "02",
      "name": "文献检索与综述",
      "purpose": "建立检索计划、候选池、closest papers 和贡献矩阵。",
      "agents": [
        "LiteratureSearchAgent",
        "MetadataVerifier",
        "PDFFetchAgent"
      ],
      "inputs": [
        "research_design.md",
        "concept_families",
        "method_keywords"
      ],
      "required_outputs": [
        {
          "artifact": "query_plan.json",
          "path_hint": "litreview/query_plan.json"
        },
        {
          "artifact": "literature_candidates.csv",
          "path_hint": "litreview/literature_candidates.csv"
        },
        {
          "artifact": "references.bib",
          "path_hint": "references.bib"
        },
        {
          "artifact": "contribution_matrix.md",
          "path_hint": "litreview/contribution_matrix.md"
        }
      ],
      "gates": [
        {
          "name": "metadata_verified",
          "type": "automated",
          "command": "python3 scripts/15_verify_bibliography.py"
        },
        {
          "name": "closest_papers_selected",
          "type": "human"
        }
      ],
      "human_checkpoints": [
        "closest papers 是否选对",
        "本文真正 gap 是什么"
      ],
      "stop_conditions": [
        "找不到最近文献",
        "引用无法核验",
        "综述只是罗列"
      ],
      "rollback_to": "01_design",
      "skills": [
        "literature-review",
        "citation-management"
      ],
      "failure_codes": [
        "LIT_NO_CLOSEST_PAPERS",
        "LIT_METADATA_UNVERIFIED",
        "LIT_FULLTEXT_BLOCKED",
        "LIT_REVIEW_IS_LIST",
        "LIT_HUMAN_CLOSEST_REQUIRED"
      ],
      "current_issues": [
        "query_plan.json: not found at litreview/query_plan.json",
        "literature_candidates.csv: not found at litreview/literature_candidates.csv",
        "references.bib: not found at references.bib",
        "contribution_matrix.md: not found at litreview/contribution_matrix.md"
      ],
      "spec_path": "workflows/agents/02_literature.agent.md"
    },
    {
      "id": "03_paper_reading",
      "step": "03",
      "name": "论文阅读与拆解",
      "purpose": "把核心文献读到表格、方法、局限和可引用证据位置。",
      "agents": [
        "PaperReadingAgent",
        "EvidenceAuditor"
      ],
      "inputs": [
        "literature_candidates.csv",
        "pdf_or_html_files"
      ],
      "required_outputs": [
        {
          "artifact": "lit_reading_notes/",
          "path_hint": "litreview/notes/compressed/"
        },
        {
          "artifact": "span_index.json",
          "path_hint": "litreview/notes/span_index.json"
        },
        {
          "artifact": "reading_state.md",
          "path_hint": "litreview/notes/reading_state.md"
        }
      ],
      "gates": [
        {
          "name": "source_spans_bound",
          "type": "automated"
        },
        {
          "name": "literature_role_confirmed",
          "type": "human"
        }
      ],
      "human_checkpoints": [
        "每篇核心文献在本文里承担什么角色"
      ],
      "stop_conditions": [
        "核心文献没有全文",
        "只有摘要级笔记",
        "claim 没有证据位置"
      ],
      "rollback_to": "02_literature",
      "skills": [
        "pdf",
        "paper-lookup",
        "literature-review"
      ],
      "failure_codes": [
        "READING_FULLTEXT_MISSING",
        "READING_ABSTRACT_ONLY",
        "READING_SPAN_MISSING",
        "READING_CLAIM_UNBOUND"
      ],
      "current_issues": [
        "lit_reading_notes/: not found at litreview/notes/compressed/",
        "span_index.json: not found at litreview/notes/span_index.json",
        "reading_state.md: not found at litreview/notes/reading_state.md"
      ],
      "spec_path": "workflows/agents/03_paper_reading.agent.md"
    },
    {
      "id": "04_data_gate",
      "step": "04",
      "name": "数据获取与清洗",
      "purpose": "证明数据能支撑研究问题，并留下可复现的数据口径。",
      "agents": [
        "DataPreparationAgent",
        "DataGateAuditor"
      ],
      "inputs": [
        "raw_data",
        "research_design.md",
        "variable_definitions_from_literature"
      ],
      "required_outputs": [
        {
          "artifact": "data_contract.md",
          "path_hint": "artifacts/data_contract.md"
        },
        {
          "artifact": "sample_attrition.csv",
          "path_hint": "artifacts/sample_attrition.csv"
        },
        {
          "artifact": "variable_dictionary.csv",
          "path_hint": "artifacts/variable_dictionary.csv"
        },
        {
          "artifact": "analysis_ready.*",
          "path_hint": "artifacts/did_sample.pkl"
        },
        {
          "artifact": "data_gate_report.md",
          "path_hint": "artifacts/data_gate_report.md"
        }
      ],
      "gates": [
        {
          "name": "data_gate_script",
          "type": "automated",
          "command": "python3 scripts/04_data_gate.py"
        },
        {
          "name": "variable_mapping_confirmed",
          "type": "human"
        }
      ],
      "human_checkpoints": [
        "变量替代是否合理",
        "数据限制是否要求改题"
      ],
      "stop_conditions": [
        "处理组或对照组缺失",
        "样本流失无法解释",
        "文献口径映射不上"
      ],
      "rollback_to": "01_design",
      "skills": [
        "StatsPAI_skill",
        "polars",
        "spreadsheets:Spreadsheets"
      ],
      "failure_codes": [
        "DATA_RAW_MISSING",
        "DATA_KEY_VARIABLE_MISSING",
        "DATA_SAMPLE_ATTRITION_UNEXPLAINED",
        "DATA_PANEL_INVALID",
        "DATA_HUMAN_VARIABLE_REQUIRED"
      ],
      "current_issues": [
        "data_contract.md: not found at artifacts/data_contract.md",
        "sample_attrition.csv: not found at artifacts/sample_attrition.csv",
        "variable_dictionary.csv: not found at artifacts/variable_dictionary.csv",
        "analysis_ready.*: not found at artifacts/did_sample.pkl",
        "data_gate_report.md: not found at artifacts/data_gate_report.md"
      ],
      "spec_path": "workflows/agents/04_data_gate.agent.md"
    },
    {
      "id": "05_causal_analysis",
      "step": "05",
      "name": "统计分析与因果推断",
      "purpose": "跑主模型、识别诊断、稳健性和失败风险记录。",
      "agents": [
        "CausalAnalysisAgent",
        "IdentificationAuditor",
        "RobustnessAuditor"
      ],
      "inputs": [
        "analysis_ready.*",
        "causal_question.yaml",
        "contribution_matrix.md"
      ],
      "required_outputs": [
        {
          "artifact": "tables/",
          "path_hint": "tables/"
        },
        {
          "artifact": "figures/",
          "path_hint": "figures/"
        },
        {
          "artifact": "model_log.md",
          "path_hint": "model_log.md"
        },
        {
          "artifact": "robustness_report.md",
          "path_hint": "robustness_report.md"
        }
      ],
      "gates": [
        {
          "name": "rerun_core_models",
          "type": "automated",
          "command": "python3 scripts/05_event_study.py && python3 scripts/06_table2.py && python3 scripts/08_robustness.py"
        },
        {
          "name": "claim_strength_confirmed",
          "type": "human"
        }
      ],
      "human_checkpoints": [
        "结果是否足以支撑主张",
        "是否回退改设计"
      ],
      "stop_conditions": [
        "placebo 明显失败",
        "结果高度敏感",
        "识别假设站不住"
      ],
      "rollback_to": "01_design",
      "skills": [
        "StatsPAI_skill",
        "aer-identification",
        "aer-robustness",
        "pyfixest"
      ],
      "failure_codes": [
        "CAUSAL_ESTIMAND_UNCLEAR",
        "CAUSAL_PLACEBO_FAILS",
        "CAUSAL_RESULT_OVERCLAIMED",
        "CAUSAL_ROLLOUT_DATA_INCOMPLETE",
        "CAUSAL_HUMAN_CLAIM_REQUIRED"